{
  "author": "imMamdouhaboammar",
  "author_url": "https://github.com/imMamdouhaboammar",
  "created_at": "2026-08-08",
  "created_with": "linkedin-animated-infographics v3.0.0",
  "description": "An animated 1080x1350 LinkedIn infographic showing how Claude Code reviews marketing draft content for buried answers, weak proof, vague angles, and bloated intros before publishing.",
  "gif": "demo.gif",
  "html": "index.html",
  "id": "claude-code-marketing-review",
  "language": "en",
  "license": "MIT",
  "rights_confirmed": true,
  "schema_version": 1,
  "story_type": "marketing-thought-leadership",
  "tags": [
    "claude-code",
    "marketing",
    "content-review",
    "editorial"
  ],
  "title": "Most Marketing Fails in Review — How I Use Claude Code Outside Code"
}
