{
  "author": "imMamdouhaboammar",
  "author_url": "https://github.com/imMamdouhaboammar",
  "created_at": "2026-08-08",
  "created_with": "linkedin-animated-infographics v3.0.0",
  "description": "An animated 1080x1350 LinkedIn thought-leadership infographic explaining Generative Engine Optimization (GEO) and Answer Engine Optimization (AEO). Features Claude Code, Codex, and GitHub Copilot mascots inspecting page readiness.",
  "gif": "demo.gif",
  "html": "index.html",
  "id": "geo-aeo-marketing-infographic",
  "language": "en",
  "license": "MIT",
  "rights_confirmed": true,
  "schema_version": 1,
  "story_type": "marketing-thought-leadership",
  "tags": [
    "geo",
    "aeo",
    "marketing",
    "claude-code",
    "codex",
    "copilot"
  ],
  "title": "If AI Can't Quote You, Buyers Won't Find You — GEO/AEO Framework"
}
